{"experimentId":"compiler-5d6a3ad-01","timestamp":"2026-08-27T19:14:12.273Z","sourceSha":"5d6a3ad","candidateDigest":"16173441b501912f","mutation":"current","fixtureIds":["adp-launch","apple-guide","servicetitan-align","product","event","sparse-brand","no-evidence"],"dimensions":{"buyerSpecificityAndEvidence":25,"narrativeCoherence":25,"brandAndCompositionFidelity":24.43,"reliabilityAndHonesty":25},"total":99.43,"blockerCodes":[],"p50Ms":0.12,"p95Ms":0.24,"decision":"keep","rationale":"clean baseline captured from the current branch"}
{"experimentId":"compiler-5d6a3ad-02","timestamp":"2026-08-27T19:14:12.273Z","sourceSha":"5d6a3ad","candidateDigest":"694711079a9b55aa","mutation":"audience-specificity","fixtureIds":["adp-launch","apple-guide","servicetitan-align","product","event","sparse-brand","no-evidence"],"dimensions":{"buyerSpecificityAndEvidence":0,"narrativeCoherence":0,"brandAndCompositionFidelity":19.43,"reliabilityAndHonesty":0},"total":19.43,"blockerCodes":["generic_recommendation_as_truth","required_gate_failure"],"p50Ms":0.05,"p95Ms":0.08,"decision":"revert","rationale":"hard blocker: generic_recommendation_as_truth, required_gate_failure"}
{"experimentId":"compiler-5d6a3ad-03","timestamp":"2026-08-27T19:14:12.273Z","sourceSha":"5d6a3ad","candidateDigest":"f333948c27a6f84a","mutation":"offer-mechanism","fixtureIds":["adp-launch","apple-guide","servicetitan-align","product","event","sparse-brand","no-evidence"],"dimensions":{"buyerSpecificityAndEvidence":15,"narrativeCoherence":20.71,"brandAndCompositionFidelity":24.43,"reliabilityAndHonesty":25},"total":85.14,"blockerCodes":[],"p50Ms":0.11,"p95Ms":0.28,"decision":"revert","rationale":"no strict improvement over 99.43"}
{"experimentId":"compiler-5d6a3ad-04","timestamp":"2026-08-27T19:14:12.273Z","sourceSha":"5d6a3ad","candidateDigest":"7028b53caad59f98","mutation":"strategy-selection","fixtureIds":["adp-launch","apple-guide","servicetitan-align","product","event","sparse-brand","no-evidence"],"dimensions":{"buyerSpecificityAndEvidence":25,"narrativeCoherence":25,"brandAndCompositionFidelity":24.43,"reliabilityAndHonesty":25},"total":99.43,"blockerCodes":[],"p50Ms":0.13,"p95Ms":0.24,"decision":"revert","rationale":"no strict improvement over 99.43"}
{"experimentId":"compiler-5d6a3ad-05","timestamp":"2026-08-27T19:14:12.273Z","sourceSha":"5d6a3ad","candidateDigest":"e346764ee23acb44","mutation":"claim-deduplication","fixtureIds":["adp-launch","apple-guide","servicetitan-align","product","event","sparse-brand","no-evidence"],"dimensions":{"buyerSpecificityAndEvidence":25,"narrativeCoherence":20,"brandAndCompositionFidelity":24.43,"reliabilityAndHonesty":25},"total":94.43,"blockerCodes":[],"p50Ms":0.14,"p95Ms":0.26,"decision":"revert","rationale":"score at or below median + 1.4826 * MAD (102.88)"}
{"experimentId":"compiler-5d6a3ad-06","timestamp":"2026-08-27T19:14:12.273Z","sourceSha":"5d6a3ad","candidateDigest":"24ca0f274cee19fb","mutation":"evidence-tightening","fixtureIds":["adp-launch","apple-guide","servicetitan-align","product","event","sparse-brand","no-evidence"],"dimensions":{"buyerSpecificityAndEvidence":23.57,"narrativeCoherence":25,"brandAndCompositionFidelity":24.43,"reliabilityAndHonesty":25},"total":98,"blockerCodes":[],"p50Ms":0.09,"p95Ms":0.13,"decision":"revert","rationale":"score at or below median + 1.4826 * MAD (101.84)"}
{"experimentId":"compiler-5d6a3ad-01","timestamp":"2026-08-27T19:29:25.827Z","sourceSha":"5d6a3ad","evaluationKind":"release-evaluation","candidateDigest":"16173441b501912f","mutation":"current","fixtureIds":["adp-launch","apple-guide","servicetitan-align","product","event","sparse-brand","no-evidence"],"dimensions":{"buyerSpecificityAndEvidence":25,"narrativeCoherence":25,"brandAndCompositionFidelity":24.43,"reliabilityAndHonesty":25},"total":99.43,"blockerCodes":[],"p50Ms":0.12,"p95Ms":0.18,"medianTotal":99.43,"madTotal":0,"retentionThreshold":99.43,"decision":"keep","rationale":"release evaluation 1 of 2: 99.43 >= 90 with no blockers","decisionScope":"current source tree, scored as-is"}
{"experimentId":"compiler-5d6a3ad-02","timestamp":"2026-08-27T19:29:26.506Z","sourceSha":"5d6a3ad","evaluationKind":"release-evaluation","candidateDigest":"16173441b501912f","mutation":"current","fixtureIds":["adp-launch","apple-guide","servicetitan-align","product","event","sparse-brand","no-evidence"],"dimensions":{"buyerSpecificityAndEvidence":25,"narrativeCoherence":25,"brandAndCompositionFidelity":24.43,"reliabilityAndHonesty":25},"total":99.43,"blockerCodes":[],"p50Ms":0.12,"p95Ms":0.21,"medianTotal":99.43,"madTotal":0,"retentionThreshold":99.43,"decision":"keep","rationale":"release evaluation 2 of 2: 99.43 >= 90 with no blockers","decisionScope":"current source tree, scored as-is"}
{"experimentId":"compiler-5d6a3ad-03","timestamp":"2026-08-27T19:29:26.506Z","sourceSha":"5d6a3ad","evaluationKind":"benchmark-simulation","candidateDigest":"694711079a9b55aa","mutation":"audience-specificity","fixtureIds":["adp-launch","apple-guide","servicetitan-align","product","event","sparse-brand","no-evidence"],"dimensions":{"buyerSpecificityAndEvidence":0,"narrativeCoherence":0,"brandAndCompositionFidelity":19.43,"reliabilityAndHonesty":0},"total":19.43,"blockerCodes":["generic_recommendation_as_truth","required_gate_failure"],"p50Ms":0.05,"p95Ms":0.08,"medianTotal":99.43,"madTotal":0,"retentionThreshold":99.43,"decision":"revert","rationale":"hard blocker: generic_recommendation_as_truth, required_gate_failure","decisionScope":"benchmark simulation over the fixture manifest; no source-tree change"}
{"experimentId":"compiler-5d6a3ad-04","timestamp":"2026-08-27T19:29:26.506Z","sourceSha":"5d6a3ad","evaluationKind":"benchmark-simulation","candidateDigest":"f333948c27a6f84a","mutation":"offer-mechanism","fixtureIds":["adp-launch","apple-guide","servicetitan-align","product","event","sparse-brand","no-evidence"],"dimensions":{"buyerSpecificityAndEvidence":15,"narrativeCoherence":20.71,"brandAndCompositionFidelity":24.43,"reliabilityAndHonesty":25},"total":85.14,"blockerCodes":[],"p50Ms":0.11,"p95Ms":0.14,"medianTotal":59.43,"madTotal":40,"retentionThreshold":118.73,"decision":"revert","rationale":"no strict improvement over 99.43","decisionScope":"benchmark simulation over the fixture manifest; no source-tree change"}
{"experimentId":"compiler-5d6a3ad-05","timestamp":"2026-08-27T19:29:26.506Z","sourceSha":"5d6a3ad","evaluationKind":"benchmark-simulation","candidateDigest":"7028b53caad59f98","mutation":"strategy-selection","fixtureIds":["adp-launch","apple-guide","servicetitan-align","product","event","sparse-brand","no-evidence"],"dimensions":{"buyerSpecificityAndEvidence":25,"narrativeCoherence":25,"brandAndCompositionFidelity":24.43,"reliabilityAndHonesty":25},"total":99.43,"blockerCodes":[],"p50Ms":0.12,"p95Ms":0.2,"medianTotal":85.14,"madTotal":14.29,"retentionThreshold":106.33,"decision":"revert","rationale":"no strict improvement over 99.43","decisionScope":"benchmark simulation over the fixture manifest; no source-tree change"}
{"experimentId":"compiler-5d6a3ad-06","timestamp":"2026-08-27T19:29:26.506Z","sourceSha":"5d6a3ad","evaluationKind":"benchmark-simulation","candidateDigest":"e346764ee23acb44","mutation":"claim-deduplication","fixtureIds":["adp-launch","apple-guide","servicetitan-align","product","event","sparse-brand","no-evidence"],"dimensions":{"buyerSpecificityAndEvidence":25,"narrativeCoherence":20,"brandAndCompositionFidelity":24.43,"reliabilityAndHonesty":25},"total":94.43,"blockerCodes":[],"p50Ms":0.12,"p95Ms":0.27,"medianTotal":92.29,"madTotal":7.15,"retentionThreshold":102.88,"decision":"revert","rationale":"score at or below median + 1.4826 * MAD (102.88)","decisionScope":"benchmark simulation over the fixture manifest; no source-tree change"}
{"experimentId":"compiler-5d6a3ad-07","timestamp":"2026-08-27T19:29:26.506Z","sourceSha":"5d6a3ad","evaluationKind":"benchmark-simulation","candidateDigest":"24ca0f274cee19fb","mutation":"evidence-tightening","fixtureIds":["adp-launch","apple-guide","servicetitan-align","product","event","sparse-brand","no-evidence"],"dimensions":{"buyerSpecificityAndEvidence":23.57,"narrativeCoherence":25,"brandAndCompositionFidelity":24.43,"reliabilityAndHonesty":25},"total":98,"blockerCodes":[],"p50Ms":0.09,"p95Ms":0.18,"medianTotal":94.43,"madTotal":5,"retentionThreshold":101.84,"decision":"revert","rationale":"score at or below median + 1.4826 * MAD (101.84)","decisionScope":"benchmark simulation over the fixture manifest; no source-tree change"}
{"experimentId":"compiler-5d6a3ad-01","timestamp":"2026-08-27T19:30:34.073Z","sourceSha":"5d6a3ad","evaluationKind":"release-evaluation","candidateDigest":"16173441b501912f","mutation":"current","fixtureIds":["adp-launch","apple-guide","servicetitan-align","product","event","sparse-brand","no-evidence"],"dimensions":{"buyerSpecificityAndEvidence":25,"narrativeCoherence":25,"brandAndCompositionFidelity":24.43,"reliabilityAndHonesty":25},"total":99.43,"blockerCodes":[],"p50Ms":0.13,"p95Ms":0.55,"medianTotal":99.43,"madTotal":0,"retentionThreshold":99.43,"decision":"keep","rationale":"release evaluation 1 of 2: 99.43 >= 90 with no blockers","decisionScope":"current source tree, scored as-is"}
{"experimentId":"compiler-5d6a3ad-02","timestamp":"2026-08-27T19:30:34.750Z","sourceSha":"5d6a3ad","evaluationKind":"release-evaluation","candidateDigest":"16173441b501912f","mutation":"current","fixtureIds":["adp-launch","apple-guide","servicetitan-align","product","event","sparse-brand","no-evidence"],"dimensions":{"buyerSpecificityAndEvidence":25,"narrativeCoherence":25,"brandAndCompositionFidelity":24.43,"reliabilityAndHonesty":25},"total":99.43,"blockerCodes":[],"p50Ms":0.13,"p95Ms":0.24,"medianTotal":99.43,"madTotal":0,"retentionThreshold":99.43,"decision":"keep","rationale":"release evaluation 2 of 2: 99.43 >= 90 with no blockers","decisionScope":"current source tree, scored as-is"}
{"experimentId":"compiler-5d6a3ad-03","timestamp":"2026-08-27T19:30:34.750Z","sourceSha":"5d6a3ad","evaluationKind":"benchmark-simulation","candidateDigest":"694711079a9b55aa","mutation":"audience-specificity","fixtureIds":["adp-launch","apple-guide","servicetitan-align","product","event","sparse-brand","no-evidence"],"dimensions":{"buyerSpecificityAndEvidence":0,"narrativeCoherence":0,"brandAndCompositionFidelity":19.43,"reliabilityAndHonesty":0},"total":19.43,"blockerCodes":["generic_recommendation_as_truth","required_gate_failure"],"p50Ms":0.05,"p95Ms":0.08,"medianTotal":99.43,"madTotal":0,"retentionThreshold":99.43,"decision":"revert","rationale":"hard blocker: generic_recommendation_as_truth, required_gate_failure","decisionScope":"benchmark simulation over the fixture manifest; no source-tree change"}
{"experimentId":"compiler-5d6a3ad-04","timestamp":"2026-08-27T19:30:34.750Z","sourceSha":"5d6a3ad","evaluationKind":"benchmark-simulation","candidateDigest":"f333948c27a6f84a","mutation":"offer-mechanism","fixtureIds":["adp-launch","apple-guide","servicetitan-align","product","event","sparse-brand","no-evidence"],"dimensions":{"buyerSpecificityAndEvidence":15,"narrativeCoherence":20.71,"brandAndCompositionFidelity":24.43,"reliabilityAndHonesty":25},"total":85.14,"blockerCodes":[],"p50Ms":0.11,"p95Ms":0.21,"medianTotal":59.43,"madTotal":40,"retentionThreshold":118.73,"decision":"revert","rationale":"no strict improvement over 99.43","decisionScope":"benchmark simulation over the fixture manifest; no source-tree change"}
{"experimentId":"compiler-5d6a3ad-05","timestamp":"2026-08-27T19:30:34.750Z","sourceSha":"5d6a3ad","evaluationKind":"benchmark-simulation","candidateDigest":"7028b53caad59f98","mutation":"strategy-selection","fixtureIds":["adp-launch","apple-guide","servicetitan-align","product","event","sparse-brand","no-evidence"],"dimensions":{"buyerSpecificityAndEvidence":25,"narrativeCoherence":25,"brandAndCompositionFidelity":24.43,"reliabilityAndHonesty":25},"total":99.43,"blockerCodes":[],"p50Ms":0.12,"p95Ms":0.21,"medianTotal":85.14,"madTotal":14.29,"retentionThreshold":106.33,"decision":"revert","rationale":"no strict improvement over 99.43","decisionScope":"benchmark simulation over the fixture manifest; no source-tree change"}
{"experimentId":"compiler-5d6a3ad-06","timestamp":"2026-08-27T19:30:34.750Z","sourceSha":"5d6a3ad","evaluationKind":"benchmark-simulation","candidateDigest":"e346764ee23acb44","mutation":"claim-deduplication","fixtureIds":["adp-launch","apple-guide","servicetitan-align","product","event","sparse-brand","no-evidence"],"dimensions":{"buyerSpecificityAndEvidence":25,"narrativeCoherence":20,"brandAndCompositionFidelity":24.43,"reliabilityAndHonesty":25},"total":94.43,"blockerCodes":[],"p50Ms":0.13,"p95Ms":0.19,"medianTotal":92.29,"madTotal":7.15,"retentionThreshold":102.88,"decision":"revert","rationale":"score at or below median + 1.4826 * MAD (102.88)","decisionScope":"benchmark simulation over the fixture manifest; no source-tree change"}
{"experimentId":"compiler-5d6a3ad-07","timestamp":"2026-08-27T19:30:34.750Z","sourceSha":"5d6a3ad","evaluationKind":"benchmark-simulation","candidateDigest":"24ca0f274cee19fb","mutation":"evidence-tightening","fixtureIds":["adp-launch","apple-guide","servicetitan-align","product","event","sparse-brand","no-evidence"],"dimensions":{"buyerSpecificityAndEvidence":23.57,"narrativeCoherence":25,"brandAndCompositionFidelity":24.43,"reliabilityAndHonesty":25},"total":98,"blockerCodes":[],"p50Ms":0.09,"p95Ms":0.17,"medianTotal":94.43,"madTotal":5,"retentionThreshold":101.84,"decision":"revert","rationale":"score at or below median + 1.4826 * MAD (101.84)","decisionScope":"benchmark simulation over the fixture manifest; no source-tree change"}
{"experimentId":"compiler-5d6a3ad-01","timestamp":"2026-08-27T19:30:47.316Z","sourceSha":"5d6a3ad","evaluationKind":"release-evaluation","candidateDigest":"16173441b501912f","mutation":"current","fixtureIds":["adp-launch","apple-guide","servicetitan-align","product","event","sparse-brand","no-evidence"],"dimensions":{"buyerSpecificityAndEvidence":25,"narrativeCoherence":25,"brandAndCompositionFidelity":24.43,"reliabilityAndHonesty":25},"total":99.43,"blockerCodes":[],"p50Ms":0.12,"p95Ms":0.28,"medianTotal":99.43,"madTotal":0,"retentionThreshold":99.43,"decision":"keep","rationale":"release evaluation 1 of 2: 99.43 >= 90 with no blockers","decisionScope":"current source tree, scored as-is"}
{"experimentId":"compiler-5d6a3ad-02","timestamp":"2026-08-27T19:30:47.965Z","sourceSha":"5d6a3ad","evaluationKind":"release-evaluation","candidateDigest":"16173441b501912f","mutation":"current","fixtureIds":["adp-launch","apple-guide","servicetitan-align","product","event","sparse-brand","no-evidence"],"dimensions":{"buyerSpecificityAndEvidence":25,"narrativeCoherence":25,"brandAndCompositionFidelity":24.43,"reliabilityAndHonesty":25},"total":99.43,"blockerCodes":[],"p50Ms":0.12,"p95Ms":0.19,"medianTotal":99.43,"madTotal":0,"retentionThreshold":99.43,"decision":"keep","rationale":"release evaluation 2 of 2: 99.43 >= 90 with no blockers","decisionScope":"current source tree, scored as-is"}
{"experimentId":"compiler-5d6a3ad-03","timestamp":"2026-08-27T19:30:47.965Z","sourceSha":"5d6a3ad","evaluationKind":"benchmark-simulation","candidateDigest":"694711079a9b55aa","mutation":"audience-specificity","fixtureIds":["adp-launch","apple-guide","servicetitan-align","product","event","sparse-brand","no-evidence"],"dimensions":{"buyerSpecificityAndEvidence":0,"narrativeCoherence":0,"brandAndCompositionFidelity":19.43,"reliabilityAndHonesty":0},"total":19.43,"blockerCodes":["generic_recommendation_as_truth","required_gate_failure"],"p50Ms":0.05,"p95Ms":0.07,"medianTotal":99.43,"madTotal":0,"retentionThreshold":99.43,"decision":"revert","rationale":"hard blocker: generic_recommendation_as_truth, required_gate_failure","decisionScope":"benchmark simulation over the fixture manifest; no source-tree change"}
{"experimentId":"compiler-5d6a3ad-04","timestamp":"2026-08-27T19:30:47.965Z","sourceSha":"5d6a3ad","evaluationKind":"benchmark-simulation","candidateDigest":"f333948c27a6f84a","mutation":"offer-mechanism","fixtureIds":["adp-launch","apple-guide","servicetitan-align","product","event","sparse-brand","no-evidence"],"dimensions":{"buyerSpecificityAndEvidence":15,"narrativeCoherence":20.71,"brandAndCompositionFidelity":24.43,"reliabilityAndHonesty":25},"total":85.14,"blockerCodes":[],"p50Ms":0.11,"p95Ms":0.19,"medianTotal":59.43,"madTotal":40,"retentionThreshold":118.73,"decision":"revert","rationale":"no strict improvement over 99.43","decisionScope":"benchmark simulation over the fixture manifest; no source-tree change"}
{"experimentId":"compiler-5d6a3ad-05","timestamp":"2026-08-27T19:30:47.965Z","sourceSha":"5d6a3ad","evaluationKind":"benchmark-simulation","candidateDigest":"7028b53caad59f98","mutation":"strategy-selection","fixtureIds":["adp-launch","apple-guide","servicetitan-align","product","event","sparse-brand","no-evidence"],"dimensions":{"buyerSpecificityAndEvidence":25,"narrativeCoherence":25,"brandAndCompositionFidelity":24.43,"reliabilityAndHonesty":25},"total":99.43,"blockerCodes":[],"p50Ms":0.12,"p95Ms":0.2,"medianTotal":85.14,"madTotal":14.29,"retentionThreshold":106.33,"decision":"revert","rationale":"no strict improvement over 99.43","decisionScope":"benchmark simulation over the fixture manifest; no source-tree change"}
{"experimentId":"compiler-5d6a3ad-06","timestamp":"2026-08-27T19:30:47.965Z","sourceSha":"5d6a3ad","evaluationKind":"benchmark-simulation","candidateDigest":"e346764ee23acb44","mutation":"claim-deduplication","fixtureIds":["adp-launch","apple-guide","servicetitan-align","product","event","sparse-brand","no-evidence"],"dimensions":{"buyerSpecificityAndEvidence":25,"narrativeCoherence":20,"brandAndCompositionFidelity":24.43,"reliabilityAndHonesty":25},"total":94.43,"blockerCodes":[],"p50Ms":0.12,"p95Ms":0.18,"medianTotal":92.29,"madTotal":7.15,"retentionThreshold":102.88,"decision":"revert","rationale":"score at or below median + 1.4826 * MAD (102.88)","decisionScope":"benchmark simulation over the fixture manifest; no source-tree change"}
{"experimentId":"compiler-5d6a3ad-07","timestamp":"2026-08-27T19:30:47.965Z","sourceSha":"5d6a3ad","evaluationKind":"benchmark-simulation","candidateDigest":"24ca0f274cee19fb","mutation":"evidence-tightening","fixtureIds":["adp-launch","apple-guide","servicetitan-align","product","event","sparse-brand","no-evidence"],"dimensions":{"buyerSpecificityAndEvidence":23.57,"narrativeCoherence":25,"brandAndCompositionFidelity":24.43,"reliabilityAndHonesty":25},"total":98,"blockerCodes":[],"p50Ms":0.08,"p95Ms":0.14,"medianTotal":94.43,"madTotal":5,"retentionThreshold":101.84,"decision":"revert","rationale":"score at or below median + 1.4826 * MAD (101.84)","decisionScope":"benchmark simulation over the fixture manifest; no source-tree change"}
{"experimentId":"compiler-5d6a3ad-01","timestamp":"2026-08-27T19:33:04.988Z","sourceSha":"5d6a3ad","evaluationKind":"release-evaluation","candidateDigest":"16173441b501912f","mutation":"current","fixtureIds":["adp-launch","apple-guide","servicetitan-align","product","event","sparse-brand","no-evidence"],"dimensions":{"buyerSpecificityAndEvidence":25,"narrativeCoherence":25,"brandAndCompositionFidelity":24.43,"reliabilityAndHonesty":25},"total":99.43,"blockerCodes":[],"p50Ms":0.12,"p95Ms":0.21,"medianTotal":99.43,"madTotal":0,"retentionThreshold":99.43,"decision":"keep","rationale":"release evaluation 1 of 2: 99.43 >= 90 with no blockers","decisionScope":"current source tree, scored as-is"}
{"experimentId":"compiler-5d6a3ad-02","timestamp":"2026-08-27T19:33:05.714Z","sourceSha":"5d6a3ad","evaluationKind":"release-evaluation","candidateDigest":"16173441b501912f","mutation":"current","fixtureIds":["adp-launch","apple-guide","servicetitan-align","product","event","sparse-brand","no-evidence"],"dimensions":{"buyerSpecificityAndEvidence":25,"narrativeCoherence":25,"brandAndCompositionFidelity":24.43,"reliabilityAndHonesty":25},"total":99.43,"blockerCodes":[],"p50Ms":0.13,"p95Ms":0.23,"medianTotal":99.43,"madTotal":0,"retentionThreshold":99.43,"decision":"keep","rationale":"release evaluation 2 of 2: 99.43 >= 90 with no blockers","decisionScope":"current source tree, scored as-is"}
{"experimentId":"compiler-5d6a3ad-03","timestamp":"2026-08-27T19:33:05.714Z","sourceSha":"5d6a3ad","evaluationKind":"benchmark-simulation","candidateDigest":"694711079a9b55aa","mutation":"audience-specificity","fixtureIds":["adp-launch","apple-guide","servicetitan-align","product","event","sparse-brand","no-evidence"],"dimensions":{"buyerSpecificityAndEvidence":0,"narrativeCoherence":0,"brandAndCompositionFidelity":19.43,"reliabilityAndHonesty":0},"total":19.43,"blockerCodes":["generic_recommendation_as_truth","required_gate_failure"],"p50Ms":0.06,"p95Ms":0.09,"medianTotal":99.43,"madTotal":0,"retentionThreshold":99.43,"decision":"revert","rationale":"hard blocker: generic_recommendation_as_truth, required_gate_failure","decisionScope":"benchmark simulation over the fixture manifest; no source-tree change"}
{"experimentId":"compiler-5d6a3ad-04","timestamp":"2026-08-27T19:33:05.714Z","sourceSha":"5d6a3ad","evaluationKind":"benchmark-simulation","candidateDigest":"f333948c27a6f84a","mutation":"offer-mechanism","fixtureIds":["adp-launch","apple-guide","servicetitan-align","product","event","sparse-brand","no-evidence"],"dimensions":{"buyerSpecificityAndEvidence":15,"narrativeCoherence":20.71,"brandAndCompositionFidelity":24.43,"reliabilityAndHonesty":25},"total":85.14,"blockerCodes":[],"p50Ms":0.11,"p95Ms":0.15,"medianTotal":59.43,"madTotal":40,"retentionThreshold":118.73,"decision":"revert","rationale":"no strict improvement over 99.43","decisionScope":"benchmark simulation over the fixture manifest; no source-tree change"}
